,URL,Dish,Cuisine,Total Time,Ingredients
216,https://www.vegrecipesofindia.com/usal-recipe-maharashtrian-usal-recipe/,Usal Recipe – Maharashtrian Malvani Usal,Maharashtrian,1 hr,"['Ingredients', 'For Cooking Sprouts', '1.5 cups mixed legumes sprouts (legumes)', '1.25 cups water for cooking sprouts', 'For The Usal Masala', '1 tablespoon oil', '1 tablespoon coriander seeds', '½ tablespoon fennel seeds (saunf)', '¼ cup onion, chopped', '4 to 5 medium garlic cloves (lahsun), chopped', '½ inch ginger (adrak), chopped', '½ cup desiccated coconut or ½ cup fresh coconut', '½ to ⅔ cup water for grinding the masala paste', 'For The Usal', '2 tablespoons oil', '¼ cup onion or 1 medium sized onion, chopped', '⅓ cup chopped tomatoes or 1 medium sized tomato, chopped', '½ teaspoon red chili powder (lal mirch powder)', '½ teaspoon turmeric powder (haldi)', '1 teaspoon malvani masala or goda masala or ½ teaspoon garam masala (optional)', '1 cup of broth or stock got from boiling the sprouts or water', 'salt as required', '2 to 3 tablespoons coriander leaves for garnishing']"
217,https://www.vegrecipesofindia.com/sukhi-arbi-recipe-sukhi-arbi/,"Sukhi Arbi Recipe, How To Make Dry Arbi Recipe For Fasting",Indian,1 hr,"['Ingredients', '250 grams colocasia roots (arbi or taro root)', '1.5 teaspoon carom seeds (ajwain)', '1 teaspoon coriander powder', '1 teaspoon red chili powder', '1 teaspoon dry mango powder (amchur)', 'oil for frying', 'few fresh mint leaves for garnishing', 'rock salt or sendha namak if making for religious fast (or regular salt for other days)', 'water to cook the arbi']"
218,https://www.vegrecipesofindia.com/besan-toast-recipe-bread-besan-toast/,Besan Toast Recipe | Bread Besan Toast | Besan Bread Toast,Indian,20 mins,"['Ingredients', '1 cup besan (gram flour)', '4 to 5 slices of bread (white or brown or whole wheat bread)', '2 to 2.5 tablespoon finely chopped onions', '2 tablespoon finely chopped tomatoes', '1 or 2 green chilies - finely chopped (skip if making for kids)', '¾ teaspoon finely chopped ginger', '1.5 to 2 teaspoon finely chopped coriander leaves (cilantro leaves)', '1 pinch asafoetida (hing)', '1/8 teaspoon turmeric powder', '¼ teaspoon red chili powder', '5 to 6 tablespoon water or add as required to make a batter of medium consistency', '1 or 2 tablespoon oil for frying or as required', 'salt as required']"
219,https://www.vegrecipesofindia.com/appam-recipe-no-yeast-appam/,No Yeast Appam,South Indian,12 hrs 30 mins,"['Ingredients', '1 cup regular rice, i added sona masuri rice', '1 or 1.25 cups cooked rice (this was cooked sona masuri rice - any cooked short grained rice works well)', '3 tablespoon husked urad dal', '¼ teaspoon methi seeds (fenugreek seeds)', '1 cup coconut milk or 250 ml coconut milk', '½ tablespoon sugar', '½ teaspoon rock salt', '¼ to 1/3 cup coconut water or water, add as required', '2 pinches of baking soda or ¼ teaspoon eno fruit salt', 'coconut oil or vegetable oil for smearing the pan or for sprinkling on the appams']"
220,https://www.vegrecipesofindia.com/dosa-recipe-dosa-batter-recipe/,Plain Dosa Recipe And Dosa Batter (Sada Dosa),South Indian,9 hrs 30 mins,"['Ingredients', '½ cup idli rice or parboiled rice or 100 grams idli rice', '½ cup regular rice or 100 grams regular rice', '¼ cup urad dal or 50 grams urad dal (husked whole or split black gram)', '⅛ teaspoon methi seeds or 2 pinches methi seeds (fenugreek seeds or methi dana)', '2 tablespoon poha (flattened rice)', '1.5 cups water for soaking both rice and lentils', '¾ cup water for grinding - do add water as required', '½ teaspoon rock salt (sendha namak) or non iodized salt or sea salt crystals or himalayan pink salt', 'oil as required']"
221,https://www.vegrecipesofindia.com/sabudana-ladoo/,"Sabudana Ladoo Recipe, How To Make Sabudana Ladoo",Indian,45 mins,"['Ingredients', '1 cup sabudana (tapoica pearls)', '¾ cup desiccated unsweetened coconut', '½ or ⅔ cup powdered sugar or as required', '6 to 6.5 tablespoon oil or ghee', '9 to 10 cashews, chopped', '4 to 5 green cardamoms, powdered', '¼ teaspoon grated nutmeg (jaiphal)']"
222,https://www.vegrecipesofindia.com/punjabi-chana-recipe-punjabi-chana/,Easy Indian Vegan Chickpea Curry,"North Indian, Punjabi",10 hrs 15 mins,"['Ingredients', 'Main Ingredients', '1 cup white chickpeas (kabuli chana or garbanzo beans)', '2.5 cups water for pressure cooking chickpeas', '1 teaspoon salt', 'For The Ground Masala Paste', '5 kashmiri red chillies - use red chilies which have a low to medium heat quotient', '5 medium sized tomatoes, roughly chopped', '2 inches ginger - chopped', '7 to 8 medium sized garlic cloves - chopped', '2 tablespoons coriander seeds', 'Other Ingredients', '3 tablespoon oil', '2 to 3 green chilies, slit', '½ to 1 cup water or add as required', 'salt as required', '½ teaspoon garam masala powder', '1 to 2 tablespoons chopped cilantro leaves (coriander leaves)', 'For Garnish', '1 inch ginger, julienne', '1 small to medium onion, thinly sliced in rounds', '1 small lemon or lime chopped in wedges']"
223,https://www.vegrecipesofindia.com/carrot-rice-recipe/,Carrot Rice,South Indian,30 mins,"['Ingredients', 'For Cooking Rice', '½ cup regular or basmati rice or 3 cups cooked rice', '¾ to 1 cups water for pressure cooking', '1/8 teaspoon salt or add as required', 'Other Ingredients', '½ cup grated carrots or 2 medium carrots grated or 100 grams carrots', '½ teaspoon mustard seeds', '1 small tej patta (indian bay leaf)', '½ inch cinnamon', '1 to 2 green cardamoms', '2 cloves', '1 green chili - chopped', '5 to 6 curry leaves', '1 pinch asafoetida (hing) - optional', '1.5 tablespoon oil', 'salt as required', 'For Garnishing', '1 small onion, thinly sliced or ¼ cup tightly packed sliced onions', '10 to 12 cashews - kept whole or halved', '10 to 12 raisins', '1 to 2 tablespoon chopped coriander leaves', '(cilantro leaves)']"
224,https://www.vegrecipesofindia.com/baked-samosa-recipe/,Healthy Baked Vegan Samosa (Whole Wheat),"North Indian, Punjabi",1 hr 10 mins,"['Ingredients', 'For Samosa Pastry', '2 cups whole wheat flour or 240 grams whole wheat flour', '¼ teaspoon ajwain (carom seeds) - optional', '5 tablespoons oil or ghee (clarified butter)', '1 teaspoon rock salt or add as required', '⅓ to ½ cup water for kneading or add as required', 'For Stuffing', '2 teaspoons oil', '½ teaspoon cumin seeds', '2 green chillies + ½ inch ginger crushed to a paste in mortar pestle', '250 grams potatoes or 3 large potatoes or 2 cups chopped potato', '⅓ cup green peas - optional', '½ teaspoon red chilli powder', '¼ teaspoon garam masala powder', '½ teaspoons coriander powder (ground coriander)', '½ teaspoon amchur (dry mango powder) - or add as per taste', 'salt as required', '2 tablespoons chopped coriander leaves (cilantro leaves)']"
225,https://www.vegrecipesofindia.com/raw-mango-rice-recipe/,Mango Rice,"Indian, Karnataka",40 mins,"['Ingredients', 'For Pressure Cooking Rice', '1.5 cups regular rice', '½ teaspoon salt', '½ teaspoon oil', '2.5 cups water', 'For The Paste', '½ cup grated coconut', '1.5 cups peeled and chopped raw unripe mango or 250 grams raw mangoes - chopped', '3 to 4 dry red chilies - broken and deseeded', '1 green chili - chopped', '1 teaspoon white sesame seeds', '2 teaspoon peanuts', '1 teaspoon jaggery - optional', 'Other Ingredients For Mango Rice', '3 tablespoon peanut oil or sesame oil or any oil', '1 or 2 dry red chilies - broken and deseeded', '1 teaspoon mustard seeds', '1 teaspoon chana dal (optional)', '1 teaspoon urad dal (optional)', '3 to 4 tablespoon peanuts', '1 pinch asafoetida (hing)', '¼ teaspoon turmeric powder', '1 sprig curry leaves or 12 to 15 curry leaves', 'salt as required']"
226,https://www.vegrecipesofindia.com/capsicum-pulao-recipe-capsicum-rice/,Capsicum Rice | One Pot Bell Pepper Rice,North Indian,45 mins,"['Ingredients', '1 cup basmati rice or 200 grams basmati rice', '2 tablespoon oil', '1 teaspoon cumin seeds (jeera)', '2 green cardamoms (choti elaichi)', '2 cloves (lavang)', '½ inch cinnamon (dalchini)', '2 small tejpatta or 1 medium to large tejpatta (indian bay leaf)', '2 single strands of mace (javitiri)', '1 medium onion, sliced or ½ cup sliced onions', '75 to 80 grams capsicum or 2 medium capsicum or ¾ cup sliced capsicum (shimla mirch or bell pepper)', '3 tablespoon chopped coriander leaves (dhania patta)', '4 to 5 drops of lemon juice', '1.75 cups water', 'salt as required']"
227,https://www.vegrecipesofindia.com/methi-pulao-recipe/,Methi Rice | Methi Pulao,Indian,45 mins,"['Ingredients', 'Main Ingredients', '1 cup basmati rice or 200 grams basmati rice', '2 cups methi leaves (fenugreek leaves) or 80 grams methi leaves, finely chopped', '¾ cup chopped mix vegetables', '1 medium to large onion, sliced or ½ cup thinly sliced onions', '½ inch ginger + 3 to 4 garlic + 2 to 3 green chilies - crushed to a paste in mortar-pestle', '¼ teaspoon turmeric powder (ground turmeric)', '½ teaspoon red chili powder', '½ teaspoon coriander powder (ground coriander)', '2 cups water', '2 to 3 tablespoon oil', 'salt as required', 'Whole Spices', '½ teaspoon cumin seeds', '1 black cardamom', '2 green cardamoms', '1 inch cinnamon', '3 to 4 cloves', '1 or 2 single strand of mace - optional']"
228,https://www.vegrecipesofindia.com/carrot-tomato-soup/,Carrot Tomato Soup,World,20 mins,"['Ingredients', '2 medium sized carrots', '2 medium sized tomatoes', '1 medium sized onion', '2 to 3 large spinach leaves - optional', '5 to 6 french beans - optional', '3 to 4 garlic cloves, chopped', '½ teaspoon cumin powder', '1 pinch asafoetida (hing) - optional', '2 to 3 pinches of black pepper powder - optional', '2 cups water', '1 or 1.5 tablespoon olive oil or butter', 'black salt or rock salt as required', 'few cilantro or parsley leaves for garnishing']"
229,https://www.vegrecipesofindia.com/falafel-recipe-chickpea-falafel-recipe/,Crispy Falafel (Traditional Method),"Lebanese, World",8 hrs 30 mins,"['Ingredients', '1 cup dried white chickpeas or 200 grams dried white chickpeas', '1 small onion - chopped or ¼ cup chopped onions', '1 teaspoon chopped garlic', '3 tablespoon chopped coriander leaves (cilantro leaves) or 3 tablespoons chopped parsley or 2 tablespoon chopped mint leaves', '½ teaspoon red chili powder or cayenne pepper or sweet paprika', '1 teaspoon ground coriander (coriander powder)', '1 teaspoon ground cumin (cumin powder)', '¼ teaspoon black pepper or ½ tsp crushed black pepper or pepper powder', '1 tablespoon all purpose flour or add as required', 'salt as required', 'oil for deep frying, as required']"
230,https://www.vegrecipesofindia.com/kerala-sambar-recipe-kerala-sambar/,Kerala Sambar,"Kerala, South Indian",1 hr 5 mins,"['Ingredients', 'For The Kerala Sambar', '1 cup tuvar dal (arhar dal, pigeon pea lentils)', '1 small onion - sliced or chopped (optional)', '1 to 2 pinch asafoetida (hing)', '10 to 12 pearl onions or shallots', '8 to 10 okra (bhindi or lady finger)', '5 to 7 aubergines (brinjal or baingan)', '1 large tomato or 2 medium size tomatoes', '1 sprig curry leaves', '½ teaspoon turmeric powder', '½ cup tamarind pulp – made with ½ cup water and 1 lemon sized ball of tamarind', '2.5 to 3 cups water or add as required', 'salt as required', 'For Tempering Kerala Sambar', '2 tablespoons coconut oil or any vegetable oil', '1 teaspoon mustard seeds', '1 teaspoon urad dal (split and husked black gram)', '1 sprig curry leaves', '2 to 3 dry red kashmiri chillies - you can also use small red bor chillies for the tadka', 'For The Sambar Masala', '½ coconut, grated – will yield about 1 to 1.5 cups of grated coconut', '3 to 4 pearl onions or shallots - chopped', '12 to 15 curry leaves', '2 tablespoons coriander seeds', '1 tablespoon cumin seeds', '¼ teaspoon whole black peppercorns', '¼ teaspoon asafoetida (hing)', '¼ teaspoon methi seeds (fenugreek seeds)', '3 to 4 dry red chilies - i used 4 kashmiri red chillies', '2 to 3 teaspoons coconut oil or any vegetable oil']"
231,https://www.vegrecipesofindia.com/mint-rice-recipe/,Pudina Rice,Indian,45 mins,"['Ingredients', 'For The Mint Paste', '1 cup mint leaves, chopped,', '½ cup coriander leaves, chopped (cilantro leaves)', '1 to 2 green chillies, chopped', '½ inch ginger, chopped or ½ teaspoon chopped ginger', '3-4 garlic, chopped or ½ teaspoon chopped garlic', ""1 tablespoon chopped coconut or 2 tbsp grated coconut or 2 tbsp coconut milk (you can also add 2 tbsp desiccated coconut if you don't have fresh coconut)"", '1 teaspoon coriander seeds', '½ teaspoon cumin seeds', '2 to 3 tablespoon water for grinding or add as required', 'Other Ingredients', '1 cup basmati rice or 200 grams basmati rice', '2 cloves', '2 small cardamom', '1 inch piece of cinnamon', '1 small to medium tej patta (indian bay leaf)', '1 medium onion, thinly sliced', '1 small tomato, sliced (optional)', '1 small to medium potato, peeled and chopped', '¼ cup heaped fresh or frozen peas', '1.5 to 2 cups water', 'salt as required']"
232,https://www.vegrecipesofindia.com/dry-fruits-milkshake/,Dry Fruits Milkshake Recipe,Indian,10 mins,"['Ingredients', '¼ cup almonds', '¼ cup unsalted pistachios, shelled', '¼ cup cashews', '¼ cup raisins', '7 to 8 dates, chopped', '2 to 3 dried figs, chopped', '1 pinch saffron', '2.5 cups milk - chilled soy or dairy milk', 'sugar as required', 'a few dry fruits for garnish - either slice or chop the dry fruits.']"
233,https://www.vegrecipesofindia.com/banana-chips-or-banana-wafers-recipe/,Homemade Fried Banana Chips | Raw Banana Wafers,Indian,40 mins,"['Ingredients', '4 medium sized raw bananas', '3 to 4 cups water', 'salt as required', 'freshly crushed black pepper as required', 'oil for deep frying']"
234,https://www.vegrecipesofindia.com/moong-sprouts-salad-recipe/,Sprouts Salad | Healthy Mung Bean Sprouts Salad,Indian,20 mins,"['Ingredients', '2 cups of sprouted moong beans', '1 small or medium sized onion, finely chopped', '1 medium size tomato, finely chopped', '1 green chilli - finely chopped, optional', '¼ teaspoon red chilli powder or ¼ teaspoon cayenne pepper', '½ or 1 teaspoon chaat masala (optional)', '1 teaspoon lemon juice or as required', '1 boiled potato or boiled sweet potato - optional - finely chopped', 'few coriander leaves for garnishing', 'lemon slices for garnishing', 'rock salt or black salt as required']"
235,https://www.vegrecipesofindia.com/bandh-gobi-matar-recipe-patta-gobhi-matar/,Patta Gobhi Matar | Cabbage Green Peas,"North Indian, Punjabi",1 hr,"['Ingredients', '200 grams cabbage (band gobhi or patta gobhi) or 4 cups of shredded cabbage', '¾ to 1 cup of fresh peas (matar)', '1 medium onion or ½ cup of finely chopped onion', '1 medium to large tomato or ½ cup of finely chopped tomatoes', '¼ teaspoon turmeric powder', '½ teaspoon kashmiri red chilli powder', '½ teaspoon coriander powder', '½ teaspoon garam masala powder', '1 teaspoon cumin seeds', '¾ to 1 teaspoon ginger-garlic paste or ½ inch ginger and 2 to 3 cloves of garlic - crushed to a paste in a mortar-pestle', '1.5 to 2 tablespoon oil', 'salt as required', 'few coriander leaves for garnishing']"
236,https://www.vegrecipesofindia.com/pickled-onions-or-sirke-wale-pyaaz/,Pickled Onions Recipe | Sirke Wale Pyaaz Recipe | Vinegar Onion Recipe,North Indian,15 mins,"['Ingredients', '15 to 20 small red onions or shallots (chote pyaaz)', '1 teaspoon white vinegar or apple cider or balsamic vinegar', '¼ cup water', '¾ teaspoon salt or add as required']"
237,https://www.vegrecipesofindia.com/idli-fry-recipe-idli-recipes/,"Idli Fry Recipe, How To Make Idli Fry | Mumbai Style Idli Fry",South Indian,11 mins,"['Ingredients', '4 to 5 idli pieces or as required', 'chaat masala or pav bhaji masala or red chilli powder or idli podi as required', 'salt as required', 'oil to deep fry or shallow fry the idlis']"
238,https://www.vegrecipesofindia.com/strawberry-jam-recipe-strawberry-recipes/,Strawberry Jam (Without Preservatives),"American, World",30 mins,"['Ingredients', '250 grams strawberry', '1.25 cups organic powdered jaggery or sugar - or add as required depending upon the sweetness of the strawberries', '1 tablespoon lemon juice (optional)']"
239,https://www.vegrecipesofindia.com/dark-chocolate-avocado-mousse/,Chocolate Avocado Mousse | Quick Dark Chocolate Avocado Mousse,"American, World",10 mins,"['Ingredients', '1 large ripe avocado (makhanphal)', '⅔ cup chopped dark semi sweet chocolate', '1 tablespoon coconut oil', '2 to 3 tablespoon regular sugar or organic cane sugar - add less or more to suit your taste', '1 teaspoon instant coffee', '½ teaspoon vanilla extract or ½ teaspoon vanilla powder', 'some chopped cashews (kaju) for garnish', 'some chopped almonds (badam) for garnish', 'some chopped pistachios (pista) for garnish']"
240,https://www.vegrecipesofindia.com/kashmiri-pulao/,Kashmiri Pulao,"Indian, Kashmiri",45 mins,"['Ingredients', 'For Kashmiri Pulao', '1 cup basmati rice soaked in water for 30 minutes', '1 inch cinnamon', '1 teaspoon caraway seeds (shahjeera)', '1 tej patta (indian bay leaf)', '3 cloves', '2 to 3 green cardamoms', '2 black cardamoms', '½ teaspoon dry ginger powder (saunth)', '1 teaspoon fennel powder', '2 pinches of saffron', '2 tablespoon oil or ghee (clarified butter)', '4 to 4.25 cups water', 'salt as required', 'For Garnishing Kashmiri Pulao', '1 medium sized onion, sliced thinly', '10 to 12 cashews', '10 to 12 almonds', '10 tp 12 walnuts', '2 tablespoon oil or ghee']"
241,https://www.vegrecipesofindia.com/lahsuni-bhindi-or-garlic-bhindi/,Lahsuni Bhindi | Okra With Garlic (Indian Style),North Indian,40 mins,"['Ingredients', '200 grams bhindi (okra or lady finger)', '1 large onion, thinly sliced', '1 tablespoon chopped or sliced garlic', '1 green chili, chopped or slit', '½ teaspoon cumin seeds', '¼ to ½ teaspoon red chili powder', '½ teaspoon turmeric powder', '½ teaspoon coriander powder', '½ teaspoon dry mango powder (amchur)', '¼ teaspoon garam masala powder', 'a pinch of asafoetida (hing)', '2 tablespoons oil', 'salt as required', 'some chopped coriander or mint leaves for garnishing']"
242,https://www.vegrecipesofindia.com/poori-bhaji/,Poori Bhaji,"Indian, Maharashtrian",40 mins,"['Ingredients', '4 medium sized potatoes (aloo or batata)', '1 large onion, chopped', '1 green chili, chopped', '1 teaspoon mustard', '1 teaspoon cumin', '1.5 teaspoon black gram (urad dal)', '¾ cup water', '½ teaspoon turmeric powder', '1 pinch asafoetida (hing)', '½ to ¾ cup chopped coriander leaves or cilantro leaves', '1 inch ginger, finely chopped', '12-15 curry leaves', '2 or 3 tablespoon peanut oil or sunflower oil', 'salt as required']"
243,https://www.vegrecipesofindia.com/lemon-squash-recipe/,Lemon Squash | Lemon Drink (Without Preservatives),World,25 mins,"['Ingredients', '500 grams lemons or 10 to 12 lemons or 1 cup lemon juice', '1 cup water', '500 grams or 2 heaped cups of organic unrefined cane sugar or regular sugar or raw sugar', '½ teaspoon saffron - crushed (optional)', '8 to 9 green cardamoms - crushed or 1 teaspoon cardamom powder (optional)']"
244,https://www.vegrecipesofindia.com/biryani-rice/,Biryani Rice,North Indian,40 mins,"['Ingredients', 'For Making Biryani Rice', '1 cup basmati rice or 200 grams basmati rice', '1.5 to 1.75 cups water', '2 tablespoon oil or ghee (clarified butter)', '1 medium tej patta (indian bay leaf)', '3 to 4 cloves', '4 to 5 whole black pepper', '1 small star anise (chakriphool)', '1 inch cinnamon', '3 to 4 green cardamoms', '2 to 3 single strands of mace', '½ teaspoon shahjeera (caraway seeds)', '1 teaspoon ginger garlic paste or 3 to 4 garlic cloves + ½ inch ginger - crushed to a paste in mortar-pestle', '1 tablespoon chopped coriander leaves (cilantro leaves)', '1 tablespoon mint leaves', '18 to 20 saffron strands', '5 to 6 drops of lemon juice', 'salt as required', 'For Garnish', '1 medium onion, thinly sliced or ⅓ cup thinly sliced onions', '10 to 12 cashews', '½ to 1 tablespoon oil', 'a few mint leaves or coriander leaves for garnish']"
245,https://www.vegrecipesofindia.com/poha-cutlet-recipe-poha-recipes/,Poha Cutlet,North Indian,40 mins,"['Ingredients', '1 cup thick poha or approx 85 grams thick poha', '1 large potato, approx 165 grams or ¾ cup mashed potatoes', '1 small carrot, finely chopped or grated or ¼ cup finely chopped or grated carrots', '4 to 5 blanched french beans, finely chopped or ¼ cup steamed or boiled green peas', '1 small onion finely chopped or ¼ cup finely chopped onion', '1 tablespoon chopped coriander leaves', '½ teaspoon ginger-garlic paste', '¼ teaspoon turmeric powder', '¼ teaspoon red chili powder', '¼ to ½ teaspoon garam masala powder', '½ teaspoon dry mango powder (amchur)', '1 teaspoon white sesame seeds', '1 pinch sugar (optional)', '3 tablespoons oil for pan frying', 'salt as per taste']"
246,https://www.vegrecipesofindia.com/kokum-curry-sol-kadhi/,"Solkadhi Recipe, How To Make Sol Kadhi | Sol Kadi","Goan, Indian",10 mins,"['Ingredients', 'For The Sol Kadi', '12 dried kokums', '1 cup water - for soaking', '2 cups water - to be added later', '1 to 1.5 cups thick coconut milk or half-half of thick coconut milk and thin coconut milk', '1 tablespoon chopped coriander leaves, for garnish', 'salt as required', 'For Tempering Sol Kadhi', '1 to 1.5 tablespoons oil', '1 teaspoon mustard seeds', '1 teaspoon cumin seeds', '1 sprig curry leaves or 9 to 10 curry leaves', '1 generous pinch asafoetida', '2 to 3 small to medium garlic cloves, slightly crushed', '1 to 2 dry kashmiri red chilies - halved and seeds removed']"
247,https://www.vegrecipesofindia.com/khus-syrup-recipe-khus-sherbet/,Khus Syrup Recipe | Khus Sharbat Recipe | How To Make Khus Syrup,Indian,37 mins,"['Ingredients', '60 to 70 grams khus grass or vetiver (ramacham in malayalam)', '5 cups water or 1 litre water', '4 cups organic unrefined cane sugar or 600 grams sugar']"
248,https://www.vegrecipesofindia.com/jam-bread-rolls/,Jam Bread Rolls,"American, World",1 hr 20 mins,"['Ingredients', '2.5 cups whole wheat flour', '½ cup all purpose flour', '½ tablespoon fresh yeast or ¾ to 1 teaspoon dry active yeast', '2 tablespoon sunflower oil', '2 tablespoon organic unrefined cane sugar or 1.5 tablespoon regular sugar', '¼ teaspoon rock salt (sendha namak)', '¾ cup jam - any fruit jam', '2 to 3 tablespoons unsweetened desiccated coconut or as required', '1 cup lukewarm water or add as required']"
249,https://www.vegrecipesofindia.com/idli-fry-recipe-idli-recipes/,"Idli Fry Recipe, How To Make Idli Fry | Mumbai Style Idli Fry",South Indian,11 mins,"['Ingredients', '4 to 5 idli pieces or as required', 'chaat masala or pav bhaji masala or red chilli powder or idli podi as required', 'salt as required', 'oil to deep fry or shallow fry the idlis']"
250,https://www.vegrecipesofindia.com/fried-modak-recipe/,Fried Modak For Ganesh Chaturthi Festival,"Indian, Maharashtrian",1 hr 5 mins,"['Ingredients', 'For The Outer Covering', '2 cups whole wheat flour (atta)', '½ teaspoon salt', '2 teaspoons warm oil', 'water as required to knead the dough', 'For The Inner Filling', '1.5 cups grated or powdered jaggery', '1.5 cups or unsweetened desiccated coconut or fresh grated coconut', '1 or 2 tablespoon roasted sesame seeds', '1 or 1.5 teaspoon cardamom powder or crushed cardamom', '1 or 2 pinch grated nutmeg - optional', '½ cup water (do not add if using fresh coconut)']"
251,https://www.vegrecipesofindia.com/dark-chocolate-avocado-mousse/,Chocolate Avocado Mousse | Quick Dark Chocolate Avocado Mousse,"American, World",10 mins,"['Ingredients', '1 large ripe avocado (makhanphal)', '⅔ cup chopped dark semi sweet chocolate', '1 tablespoon coconut oil', '2 to 3 tablespoon regular sugar or organic cane sugar - add less or more to suit your taste', '1 teaspoon instant coffee', '½ teaspoon vanilla extract or ½ teaspoon vanilla powder', 'some chopped cashews (kaju) for garnish', 'some chopped almonds (badam) for garnish', 'some chopped pistachios (pista) for garnish']"
252,https://www.vegrecipesofindia.com/jowar-roti-recipe-jowar-bhakri/,Jowar Roti,"Karnataka, Maharashtrian",30 mins,"['Ingredients', '1 cup jowar flour (sorghum flour) or 100 grams jowar flour', '¾ cup hot water or add as required', '⅛ teaspoon salt or 2 to 3 pinches of salt']"
253,https://www.vegrecipesofindia.com/dry-fruit-barfi-recipe/,Dry Fruit Burfi,North Indian,25 mins,"['Ingredients', '140 to 150 grams seedless dates or about ¾ cup seedless dates', '60 grams dried figs or 6 to 7 dried figs', '1 tablespoon golden raisins', '40 grams almonds or ¼ cup almonds', '30 grams cashews or ¼ cup cashews', '30 grams pistachios or ¼ cup pistachios', '30 grams walnuts or ¼ cup walnuts', '2 tablespoon desiccated coconut', '1 tablespoon white sesame seeds', '1 teaspoon coconut oil', '2 teaspoon rose water or ¼ to ½ teaspoon cardamom powder']"
254,https://www.vegrecipesofindia.com/ragi-dosa-recipe/,Ragi Dosa – 2 Ways (Instant Ragi Dosa And Fermented Ragi Dosa),South Indian,40 mins,"['Ingredients', '1 cup ragi flour or sprouted ragi flour - 150 grams', '¼ cup besan (gram flour) or rice flour', '⅓ to ½ cup finely chopped onions', '½ teaspoon finely chopped ginger or ½ inch ginger, finely chopped', '1 green chilli - chopped', '8 to 10 curry leaves - chopped', '3 tablespoons chopped coriander leaves (cilantro)', '½ teaspoon cumin seeds', '1 pinch asafoetida - optional', '3 tablespoons fresh grated coconut or or desiccated coconut', '½ cup buttermilk or ¼ cup curd (yogurt) mixed in ¼ cup water', '1.5 cups water or add as required', 'salt as required', 'oil or ghee as required for making dosa']"
