,URL,Dish,Cuisine,Total Time,Ingredients
723,https://www.vegrecipesofindia.com/baingan-chutney-recipe/,Brinjal Chutney | Vankaya Chutney,North Indian,25 mins,"['Ingredients', '1 medium bharta brinjal or a large baingan (aubergine or vangi or kathirikai or vankaya)', '1 tablespoon chopped onion', '2 garlic cloves + ½ inch ginger - made into a paste or ½ teaspoon ginger-garlic paste (adrak lahsun ka paste)', '¼ teaspoon ajwain (carom seeds)', '¼ teaspoon kashmiri red chili powder or add as required', '1 tablespoon oil', 'salt as required', 'a few coriander leaves or parsley for garnish']"
724,https://www.vegrecipesofindia.com/french-beans-foogath-recipe/,French Beans Recipe | Goan Beans Foogath Recipe | Beans Recipe With Coconut,Goan,25 mins,"['Ingredients', '200 to 250 grams french beans', '1 small to medium sized onion, finely chopped', '1 green chili, chopped', '½ teaspoon mustard seeds', '½ teaspoon cumin seeds', '¼ teaspoon turmeric powder', '1 pinch asafoetida (hing) - optional', '10 to 12 curry leaves', '1.5 to 2 tablespoon fresh grated coconut', '1 tablespoon chopped coriander leaves', '1 to 1.5 tablespoon vegetable oil or coconut oil', 'salt as required']"
725,https://www.vegrecipesofindia.com/veg-noodle-soup-recipe/,Noodle Soup With Mix Veggies (Vegan),Indo Chinese,30 mins,"['Ingredients', 'For Cooking Noodles', '75 grams noodles, instant, whole wheat or rice - cal also use 2 cups cooked noodles', '3 cups water', '½ teaspoon salt', 'Other Ingredients', '1 tablespoon oil - toasted sesame oil or peanut oil or sunflower oil', '½ teaspoon finely chopped garlic', '¼ cup chopped spring onions', '½ cup shredded cabbage', '⅓ cup shredded carrots', '⅓ cup diagonally thinly sliced french beans', '¼ cup thinly sliced capsicum (green bell pepper)', '4 cups water - 1 litre water or 1 litre vegetable stock', '2 to 3 teaspoons soy sauce (naturally fermented) or add as required', 'salt as required', '½ to 1 teaspoon rice vinegar or white vinegar or apple cider vinegar', '2 tablespoons chopped spring onion greens', '3 tablespoons chopped coriander leaves', '1 tablespoon chopped spring onion greens - for garnish']"
726,https://www.vegrecipesofindia.com/baingan-chokha-recipe/,Baingan Ka Chokha,Bihari,15 mins,"['Ingredients', '420 grams large eggplant (baingan) or 1 large bharta baingan', '⅓ cup chopped onions or 1 medium onion - chopped or 50 grams onion', '½ teaspoon chopped green chilies', '½ teaspoon chopped garlic', '1 to 2 tablespoons chopped coriander leaves', '(cilantro leaves)', '1 teaspoon mustard oil', '¼ to ½ teaspoon lemon juice (optional)', 'salt as required']"
727,https://www.vegrecipesofindia.com/jhal-muri-recipe/,Jhal Muri,"Bengali, Indian Street Food",15 mins,"['Ingredients', 'Main Ingredients For Jhal Muri', '2 cups puffed rice (murmura, muri)', '¼ cup finely chopped onions', '¼ cup finely chopped cucumber', '¼ cup finely chopped tomato', '½ cup chopped boiled potatoes or 1 medium potato, boiled', '1 to 2 green chilies - finely chopped', '½ teaspoon finely chopped or minced ginger', '¼ cup roasted peanuts', '2 to 3 tablespoons sev or chana chur', '1 teaspoon mustard oil', '2 to 3 tablespoons chopped coriander leaves', '1 teaspoon lemon juice or add as required', '1 to 2 tablespoons chopped fresh coconut - optional', 'Spice Powders For Making Jhal Muri', '½ teaspoon coriander powder', '½ teaspoon cumin powder', '¼ teaspoon black pepper powder or white pepper powder', '½ teaspoon red chili powder', '¼ teaspoon garam masala powder', '1 teaspoon dry mango powder', '½ teaspoon black salt', '½ teaspoon rock salt or regular salt or add as per taste']"
728,https://www.vegrecipesofindia.com/farali-batata-vada-recipe/,Farali Batata Vada Recipe | Falahari Aloo Vada Recipe,Gujarati,40 mins,"['Ingredients', 'For Potato Stuffing', '300 grams potatoes (aloo) or 3 medium potatoes - boiled', '¼ teaspoon black pepper - crushed or ½ teaspoon crushed black pepper (kali mirch powder) or add as required', '8 to 10 cashews - chopped (kaju)', '1.5 to 2 teaspoons raisins - chopped (kishmish)', '½ teaspoon lemon juice or amchur powder (dry mango powder)', 'rock salt (sendha namak) - add as required', 'For Batata Vada Batter', '1 cup amaranth flour (rajgira atta)', '½ teaspoon cumin seeds - slightly crushed (jeera)', '⅔ to ¾ cup water - add as required', 'rock salt as required (sendha namak)', 'Other Ingredients', 'peanut oil for deep frying (moongphali ka tel)']"
729,https://www.vegrecipesofindia.com/fafda-recipe/,Fafda Recipe,Gujarati,30 mins,"['Ingredients', '1 cup besan (gram flour)', '¼ teaspoon ajwain (carom seeds)', '10 to 12 black pepper - crushed coarsely', '¼ teaspoon turmeric (haldi)', '1 pinch asafoetida (hing)', '⅛ teaspoon baking soda or 2 to 3 pinches baking soda', '3 to 4 tablespoons water or add as required', '2 tablespoons oil', '¾ teaspoon salt or add as required', 'oil for deep frying, as required']"
730,https://www.vegrecipesofindia.com/sukhi-urad-dal-recipe/,"Sukhi Urad Dal Recipe, How To Make Dry Urad Dal Recipe","North Indian, Punjabi",4 hrs 10 mins,"['Ingredients', '2 tablespoons oil', '1 pinch of asafoetida (hing)', '1 cup urad dal (husked and split black gram)', '½ teaspoon turmeric powder (haldi)', '1 or 2 green chilies (hari mirch)', '⅛ teaspoon red chili powder (lal mirch powder) or 2 to 3 pinches', '¼ cup water', 'salt as required', '¼ teaspoon garam masala powder', 'some chopped coriander leaves,']"
731,https://www.vegrecipesofindia.com/arbi-tikki-arbi-patties/,Arbi Tikki Recipe | Arbi Patties Recipe | How To Make Arbi Tikki,Indian,40 mins,"['Ingredients', '250 grams arbi (colocasia roots)', '3 to 4 tablespoons singhare ka atta (water chestnut flour)', '1 inch green chili + ½ ginger made into a paste', '1 teaspoon ajwain (carom seeds)', 'rock salt (sendha namak) as required', '2 to 3 teaspoons oil or as required for frying the tikkis']"
732,https://www.vegrecipesofindia.com/macaroni-recipe/,Macaroni Recipe | Indian Style Macaroni Pasta,Indian,30 mins,"['Ingredients', 'For Cooking Macaroni', '1 heaped cup macaroni or elbow macaroni or 125 grams macaroni', '½ teaspoon salt', '3 cups water', 'Other Ingredients', '2 tablespoons oil (can use sunflower oil or olive oil)', '½ teaspoon minced garlic or finely chopped garlic or 3 to 4 small garlic cloves, minced or finely chopped', '⅓ cup finely chopped onions or 1 medium onion, finely chopped', '1 cup tightly packed finely chopped tomatoes or 3 medium tomatoes or 180 grams tomatoes', '1.25 to 1.5 cups chopped mix vegetables like carrots, green beans, cauliflower, capsicum, baby corn, potatoes etc', '¼ cup green peas – fresh or frozen', '¼ teaspoon black pepper powder', '¼ teaspoon turmeric powder', '¼ teaspoon garam masala powder', '½ teaspoon kashmiri red chilli powder', '½ teaspoon coriander powder', '½ teaspoon cumin powder', 'salt as per taste', '1 cup water', '1 teaspoon mixed dry herbs – basil, thyme, oregano, parsley etc', '1 tablespoon chopped coriander leaves for garnish']"
733,https://www.vegrecipesofindia.com/avocado-garlic-toast-recipe/,Avocado Toast,"American, World",15 mins,"['Ingredients', 'For The Toasts', '8 to 10 slices from baguette or garlic bread or french loaf', '1 to 2 teaspoon extra virgin olive oil for brushing', '1 medium sized garlic clove, halved', 'For The Avocado Filling', '1 medium to large avocado', '1 small to medium garlic cloves, minced or finely chopped', '½ teaspoon oregano or add as required', 'crushed black pepper as required', 'a few drops of lemon juice', 'salt as required']"
734,https://www.vegrecipesofindia.com/strawberry-almond-milkshake/,Strawberry Almond Milkshake,World,10 mins,"['Ingredients', '200 to 250 grams strawberry, hulled and chopped', '2.5 cups regular milk or almond milk', '½ teaspoon vanilla powder or vanilla extract or half of a vanilla bean scraped (optional)', 'powdered jaggery or organic cane sugar as required', '2 scoops vanilla or any ice cream', 'ice cubes (optional)']"
735,https://www.vegrecipesofindia.com/coriander-coconut-chutney/,Green Coriander Coconut Chutney | Cilantro Coconut Chutney,South Indian,15 mins,"['Ingredients', 'Main Ingredients', '¾ tightly packed coriander leaves (cilantro)', '¾ cup grated coconut, fresh or frozen', '1 green chili, chopped', '½ inch ginger, chopped', '1.5 or 2 tablespoon of roasted chana dal', '½ teaspoon lemon juice or add as required', '1 teaspoon sugar', 'salt as required', '½ cup water or add as required', 'For Tempering', '½ teaspoon mustard seeds', '¾ teaspoon urad dal (split and husked black gram)', '8 to 10 curry leaves', '1 pinch asafoetida (hing)', '1 tablespoon oil']"
736,https://www.vegrecipesofindia.com/suran-vada-recipe-suran-cutlet-patties/,Suran Vada Recipe | Suran Cutlet Recipe | Suran Patties Recipe,Indian,45 mins,"['Ingredients', 'Main Ingredients For Suran Vada', '200 grams suran or 1 small round sized suran (yam)', '½ teaspoon lemon or lime juice', '1 teaspoon finely chopped ginger (adrak)', '1 teaspoon chopped green chilies (hari mirch)', '6 to 7 curry leaves, finely chopped or 1 teaspoon finely chopped curry leaves (kadi patta)', '2 tablespoon chopped coriander leaves (dhania patta)', '2 to 3 tablespoon rice flour', '1 tablespoon rice flour for coating and dusting', '2 tablespoon oil for frying', 'salt as required', 'To Be Coarsely Pounded', '½ teaspoon black pepper (sabut kali mirch)', '½ teaspoon cumin seeds (jeera)', '½ teaspoon fennel seeds (saunf)', '3 to 4 fenugreek seeds (methi dana)', '2 cloves (lavang)']"
737,https://www.vegrecipesofindia.com/spring-onion-paratha-recipe/,Spring Onion Paratha,North Indian,35 mins,"['Ingredients', '2 cups whole wheat flour', '½ cup finely chopped spring onions (scallions) or 2 to 3 medium sized spring onions, finely chopped', '½ teaspoon ginger-garlic paste', '1 green chili, chopped', '¼ teaspoon turmeric powder', '¼ teaspoon red chilli powder', '¼ teaspoon garam masala powder', '½ teaspoon ajwain seeds (carom seeds)', '⅓ cup water or add as required', '1 tablespoon oil for the dough', 'salt as per taste', 'oil or ghee (clarified butter) as required while roasting']"
738,https://www.vegrecipesofindia.com/masala-pyaaz-recipe-onion-recipes/,Masala Onion Salad Recipe | Masala Pyaaz Recipe | Onion Recipes,North Indian,5 mins,"['Ingredients', '1 medium onion or 50 grams onions or ⅓ cup sliced onions', '¼ teaspoon red chili powder', '¼ teaspoon roasted cumin powder', '¼ teaspoon chaat masala', '¼ teaspoon black pepper powder - optional', 'black salt or rock salt or regular salt as per taste', '1 teaspoon lemon or lime juice', '1 teaspoon chopped mint leaves', '1 teaspoon chopped coriander leaves']"
739,https://www.vegrecipesofindia.com/musk-melon-juice/,Musk Melon Juice | Muskmelon Benefits,World,15 mins,"['Ingredients', '1 muskmelon or kharbuja or cantaloupe, any size', 'cane sugar or golden sugar or jaggery as required - optional']"
740,https://www.vegrecipesofindia.com/mango-cream-mango-coconut-cream/,"Mango Cream Recipe, Mangoes With Coconut Cream",World,20 mins,"['Ingredients', '2 medium sized alphonso mangoes', '400 ml coconut cream - reserve some coconut cream for topping', '½ teaspoon cinnamon powder or green cardamom powder', 'coconut sugar or powdered jaggery or sugar as required']"
741,https://www.vegrecipesofindia.com/vegetable-raita-recipe/,"Veg Raita Recipe, How To Make Vegetable Raita | Mix Veg Raita",Indian,15 mins,"['Ingredients', '1 cup yogurt (curd or dahi) - dairy or vegan yogurt', '1 small to medium carrot, peeled and chopped finely', '1 small to medium bell pepper (capsicum or shimla mirch - red, orange, yellow or green) - chopped finely', '1 medium cucumber - peeled and chopped finely', '1 medium tomato, finely chopped', '1 small to medium onion, finely chopped (optional)', '¼ teaspoon black pepper powder (kali mirch powder)', '½ teaspoon roasted cumin powder (bhuna jeera powder)', 'black salt or rock salt as required']"
742,https://www.vegrecipesofindia.com/kachumber-salad-kuchumber-salad/,"Kachumber Salad Recipe, How To Make Kachumber Salad | Kuchumber Salad",Indian,15 mins,"['Ingredients', '1 medium sized onion, chopped', '2 medium sized tomatoes, chopped', '2 to 3 small sized cucumber, chopped', '4 to 5 mint leaves, chopped', '¼ cup coriander leaves, chopped (cilantro leaves)', '½ or 1 teaspoon lemon juice', 'a few lemon pieces for garnish', '½ teaspoon roasted cumin powder - optional', '1 green chili or ¼ teaspoon red chili powder - optional', 'black salt or rock salt or regular salt as required']"
743,https://www.vegrecipesofindia.com/aloo-palak-paratha-recipe/,Aloo Palak Paratha,North Indian,1 hr 10 mins,"['Ingredients', '15 to 18 medium to large palak leaves (spinach) - yields approx ½ or ¾ cup spinach puree', '2 medium potatoes - peeled, boiled and mashed, approx 1 cup mashed potatoes', '2 to 3 garlic - crushed or made into a paste in a mortar-pestle', '½ teaspoon cumin powder', '½ teaspoon coriander powder', '½ teaspoon red chili powder', '¼ teaspoon turmeric powder', '2 cups whole wheat flour', '1 tablespoon yogurt (curd) - optional', '1 teaspoon oil', 'salt as required', 'oil or ghee as required for frying the parathas']"
744,https://www.vegrecipesofindia.com/avocado-garlic-toast-recipe/,Avocado Toast,"American, World",15 mins,"['Ingredients', 'For The Toasts', '8 to 10 slices from baguette or garlic bread or french loaf', '1 to 2 teaspoon extra virgin olive oil for brushing', '1 medium sized garlic clove, halved', 'For The Avocado Filling', '1 medium to large avocado', '1 small to medium garlic cloves, minced or finely chopped', '½ teaspoon oregano or add as required', 'crushed black pepper as required', 'a few drops of lemon juice', 'salt as required']"
745,https://www.vegrecipesofindia.com/coriander-coconut-chutney/,Green Coriander Coconut Chutney | Cilantro Coconut Chutney,South Indian,15 mins,"['Ingredients', 'Main Ingredients', '¾ tightly packed coriander leaves (cilantro)', '¾ cup grated coconut, fresh or frozen', '1 green chili, chopped', '½ inch ginger, chopped', '1.5 or 2 tablespoon of roasted chana dal', '½ teaspoon lemon juice or add as required', '1 teaspoon sugar', 'salt as required', '½ cup water or add as required', 'For Tempering', '½ teaspoon mustard seeds', '¾ teaspoon urad dal (split and husked black gram)', '8 to 10 curry leaves', '1 pinch asafoetida (hing)', '1 tablespoon oil']"
746,https://www.vegrecipesofindia.com/suran-vada-recipe-suran-cutlet-patties/,Suran Vada Recipe | Suran Cutlet Recipe | Suran Patties Recipe,Indian,45 mins,"['Ingredients', 'Main Ingredients For Suran Vada', '200 grams suran or 1 small round sized suran (yam)', '½ teaspoon lemon or lime juice', '1 teaspoon finely chopped ginger (adrak)', '1 teaspoon chopped green chilies (hari mirch)', '6 to 7 curry leaves, finely chopped or 1 teaspoon finely chopped curry leaves (kadi patta)', '2 tablespoon chopped coriander leaves (dhania patta)', '2 to 3 tablespoon rice flour', '1 tablespoon rice flour for coating and dusting', '2 tablespoon oil for frying', 'salt as required', 'To Be Coarsely Pounded', '½ teaspoon black pepper (sabut kali mirch)', '½ teaspoon cumin seeds (jeera)', '½ teaspoon fennel seeds (saunf)', '3 to 4 fenugreek seeds (methi dana)', '2 cloves (lavang)']"
747,https://www.vegrecipesofindia.com/bread-cutlet-recipe/,Bread Cutlet (With Mixed Veggies),Indian,40 mins,"['Ingredients', '3 medium sized potatoes', '⅓ cup green peas', '⅓ cup grated carrots', '3 sandwich bread slices - you can use any bread like whole wheat bread or brown bread or white bread', '½ inch ginger , roughly chopped', '2 garlic cloves , roughly chopped', '1 green chili , roughly chopped', '8 to 10 black peppercorns', '2 pinch turmeric powder', '¼ teaspoon red chilli powder', '¼ teaspoon garam masala powder', 'salt as required', '2 to 3 tablespoons oil for frying', '1 bread slice for making bread crumbs', '2 tablespoons chopped coriander leaves']"
748,https://www.vegrecipesofindia.com/vendhaya-dosa-recipe-vendhaya-dosai/,"Vendhaya Dosa Recipe, How To Make Vendhaya Dosai | Methi Dosa Recipe",South Indian,9 hrs 30 mins,"['Ingredients', '1 cup idli rice or parboiled rice or 200 to 205 grams idli rice', '¼ cup whole or split urad dal (husked black gram) or 50 grams', '¼ cup tuvar dal (arhar dal or pigeon pea lentils) or 50 grams tuvar dal', '1 tablespoon fenugreek seeds (methi seeds or vendhayam) or 12 grams fenugreek seeds', '¼ cup water for soaking methi seeds', '1.5 cups water for soaking rice and dals', '¾ cup water or add as required', '¼ to ⅓ teaspoon rock salt or add as required', 'oil as required']"
749,https://www.vegrecipesofindia.com/spring-onion-paratha-recipe/,Spring Onion Paratha,North Indian,35 mins,"['Ingredients', '2 cups whole wheat flour', '½ cup finely chopped spring onions (scallions) or 2 to 3 medium sized spring onions, finely chopped', '½ teaspoon ginger-garlic paste', '1 green chili, chopped', '¼ teaspoon turmeric powder', '¼ teaspoon red chilli powder', '¼ teaspoon garam masala powder', '½ teaspoon ajwain seeds (carom seeds)', '⅓ cup water or add as required', '1 tablespoon oil for the dough', 'salt as per taste', 'oil or ghee (clarified butter) as required while roasting']"
750,https://www.vegrecipesofindia.com/pineapple-smoothie-recipe/,Healthy Pineapple Smoothie (Vegan & 3 Ingredients),"American, World",10 mins,"['Ingredients', '2 cups chopped pineapple or 9 to 10 pineapple slices', '1.5 cups coconut milk (thin to medium consistency)', '1 pinch ground cinnamon (cinnamon powder) - optional', '1 to 2 tablespoons sugar - optional']"
751,https://www.vegrecipesofindia.com/musk-melon-juice/,Musk Melon Juice | Muskmelon Benefits,World,15 mins,"['Ingredients', '1 muskmelon or kharbuja or cantaloupe, any size', 'cane sugar or golden sugar or jaggery as required - optional']"
752,https://www.vegrecipesofindia.com/vegetable-raita-recipe/,"Veg Raita Recipe, How To Make Vegetable Raita | Mix Veg Raita",Indian,15 mins,"['Ingredients', '1 cup yogurt (curd or dahi) - dairy or vegan yogurt', '1 small to medium carrot, peeled and chopped finely', '1 small to medium bell pepper (capsicum or shimla mirch - red, orange, yellow or green) - chopped finely', '1 medium cucumber - peeled and chopped finely', '1 medium tomato, finely chopped', '1 small to medium onion, finely chopped (optional)', '¼ teaspoon black pepper powder (kali mirch powder)', '½ teaspoon roasted cumin powder (bhuna jeera powder)', 'black salt or rock salt as required']"
753,https://www.vegrecipesofindia.com/vegan-pesto-recipe/,Pesto Recipe | Homemade Vegan Pesto Sauce,World,8 mins,"['Ingredients', '2 cups fresh basil leaves or 50 grams fresh basil leaves', '¼ cup almonds, lightly roasted', '⅓ cup extra virgin olive oil', '2 small to medium sized garlic cloves', '4 to 5 black peppercorns - optional', '⅛ teaspoon salt or add as per taste']"
754,https://www.vegrecipesofindia.com/aloo-palak-paratha-recipe/,Aloo Palak Paratha,North Indian,1 hr 10 mins,"['Ingredients', '15 to 18 medium to large palak leaves (spinach) - yields approx ½ or ¾ cup spinach puree', '2 medium potatoes - peeled, boiled and mashed, approx 1 cup mashed potatoes', '2 to 3 garlic - crushed or made into a paste in a mortar-pestle', '½ teaspoon cumin powder', '½ teaspoon coriander powder', '½ teaspoon red chili powder', '¼ teaspoon turmeric powder', '2 cups whole wheat flour', '1 tablespoon yogurt (curd) - optional', '1 teaspoon oil', 'salt as required', 'oil or ghee as required for frying the parathas']"
755,https://www.vegrecipesofindia.com/aloo-makhana-recipe/,Aloo Makhana For Navratri Vrat,North Indian,23 mins,"['Ingredients', '300 grams potatoes or 4 medium potatoes - boiled, peeled and chopped', '1.5 cups makhana (foxnuts or phool makhana)', '1 teaspoon roasted anardana (dry pomegranate seeds) - crushed to a powder in a mortar-pestle or 1 teaspoon dry pomegranate powder', '1 teaspoon cumin powder', '1 green chili - chopped', '1 tablespoon chopped mint leaves', '½ tablespoon oil or ghee', 'rock salt or sendha namak as required']"
756,https://www.vegrecipesofindia.com/marus-bhajia-recipe-crispy-potato-bhajia/,Maru’S Bhajia | Crispy Potato Bhajia | Maru Na Bhajiya,Gujarati,30 mins,"['Ingredients', '300 grams potatoes or 8 small potatoes or 3 to 4 medium sized potatoes or 2 cups sliced potatoes', '1.5 cups besan (gram flour)', '2 to 3 green chilies - chopped', '¼ cup coriander leaves - chopped', '1 inch ginger - finely chopped', '¼ teaspoon turmeric powder', '2 tablespoons lemon juice', 'salt as required', 'oil for deep frying']"
757,https://www.vegrecipesofindia.com/bel-ka-sharbat-recipe/,Bel Ka Sharbat Recipe | Bael Sharbat Recipe | Wood Apple Drink Recipe,North Indian,25 mins,"['Ingredients', '3 small to medium sized bel fruit (bengal quince or stone apple or wood apple)', '3 to 3.5 cups chilled water', '12 tablespoons jaggery or add as required', '⅓ teaspoon cardamom powder (choti elaichi powder)', '⅓ teaspoon of roasted cumin powder (bhuna jeera powder)', '2 pinches black salt']"
758,https://www.vegrecipesofindia.com/bread-cutlet-recipe/,Bread Cutlet (With Mixed Veggies),Indian,40 mins,"['Ingredients', '3 medium sized potatoes', '⅓ cup green peas', '⅓ cup grated carrots', '3 sandwich bread slices - you can use any bread like whole wheat bread or brown bread or white bread', '½ inch ginger , roughly chopped', '2 garlic cloves , roughly chopped', '1 green chili , roughly chopped', '8 to 10 black peppercorns', '2 pinch turmeric powder', '¼ teaspoon red chilli powder', '¼ teaspoon garam masala powder', 'salt as required', '2 to 3 tablespoons oil for frying', '1 bread slice for making bread crumbs', '2 tablespoons chopped coriander leaves']"
759,https://www.vegrecipesofindia.com/mirchi-bajji-recip/,Mirchi Bajji | Mirapakaya Bajji,"Andhra, Indian Street Food, South Indian",40 mins,"['Ingredients', 'Main Ingredient', '200 grams green chillies (bajji mirchi) or 8 to 9 large green chillies, seeds removed', 'For Mirchi Bajji Batter', '1.5 cups besan (gram flour)', '¼ cup rice flour', '¼ teaspoon red chilli powder', '¼ teaspoon turmeric powder', '1 pinch asafoetida (hing)', '½ teaspoon carom seeds (ajwain)', '⅛ teaspoon baking soda or 2 to 3 pinches baking soda', 'salt as per taste', '1 cup water or add as required', 'Stuffing 1 For Mirchi Bajji', '1.5 tablespoons cumin powder', '1 teaspoon salt or add as per taste', '2 tablespoons lemon juice', 'Stuffing 2 For Mirchi Bajji', '1 medium onion - chopped or ½ cup chopped onion', '2 tablespoons chopped coriander leaves', '⅛ teaspoon red chilli powder or 2 to 3 pinches red chilli powder', '½ teaspoon chaat masala powder', '1 teaspoon lemon juice', '⅛ teaspoon salt or 2 to 3 pinches salt or add as required', 'Other Ingredient', 'oil as required - for deep frying']"
760,https://www.vegrecipesofindia.com/vendhaya-dosa-recipe-vendhaya-dosai/,"Vendhaya Dosa Recipe, How To Make Vendhaya Dosai | Methi Dosa Recipe",South Indian,9 hrs 30 mins,"['Ingredients', '1 cup idli rice or parboiled rice or 200 to 205 grams idli rice', '¼ cup whole or split urad dal (husked black gram) or 50 grams', '¼ cup tuvar dal (arhar dal or pigeon pea lentils) or 50 grams tuvar dal', '1 tablespoon fenugreek seeds (methi seeds or vendhayam) or 12 grams fenugreek seeds', '¼ cup water for soaking methi seeds', '1.5 cups water for soaking rice and dals', '¾ cup water or add as required', '¼ to ⅓ teaspoon rock salt or add as required', 'oil as required']"
761,https://www.vegrecipesofindia.com/papdi-bhaji-recipe-val-papdi-bhaji/,Papdi Bhaji Recipe | Surti Papdi Bhaji Recipe | Easy Val Papdi Sabzi Recipe,Goan,35 mins,"['Ingredients', '200 to 250 grams papdi (flat green beans or field beans or valor or val papdi)', '3 to 4 shallots or 1 small to medium onion - finely chopped', '2 to 3 garlic - finely chopped', '¼ teaspoon turmeric powder', '1 green chili - chopped', '3 tablespoon grated coconut', '1 tablespoon oil', 'salt as required', 'few chopped coriander leaves for garnishing']"
762,https://www.vegrecipesofindia.com/watermelon-agua-fresca/,Refreshing Mexican Watermelon Agua Fresca,"Mexican, World",15 mins,"['Ingredients', '4 to 5 cups chopped deseeded watermelon', '1 to 2 cups water or as required', '½ inch chopped ginger', '1 tablespoon lemon juice or as required', 'ice cubes (optional)', 'mint leaves for garnishing - optional', 'sugar as required - optional']"
763,https://www.vegrecipesofindia.com/pan-fried-tofu-recipe/,"Pan Fried Tofu Recipe, How To Make Pan Fried Tofu With Peanut Sauce",World,35 mins,"['Ingredients', 'For The Peanut Sauce', '3 tablespoon smooth peanut butter', '1 tablespoon apple cider vinegar or rice vinegar', '½ to 1 tablespoon organic cane sugar or as required - depends upon the sweetness of the peanut sauce', '½ teaspoon red chilli powder or red chili flakes', '¼ teaspoon soy sauce', 'salt as required', 'For The Pan Fried Tofu', '250 grams plain tofu', '3 tablespoon all purpose flour', '3 tablespoon cornflour (cornstarch)', '½ teaspoon red chilli powder or red chili flakes', '½ teaspoon black pepper powder', '½ teaspoon soy sauce', '¼ teaspoon baking powder', '1 or 2 sichuan pepper, crushed (optional)', '2 to 3 tablespoon oil for pan frying', '½ cup water', 'salt as required']"
