,URL,Dish,Cuisine,Total Time,Ingredients
467,https://www.vegrecipesofindia.com/cabbage-thoran/,Cabbage Thoran Recipe | Cabbage Fry Recipe | How To Make Cabbage Thoran,Kerala,30 mins,"['Ingredients', '1 medium sized cabbage', '1 medium sized onion or 4 to 5 shallots - finely chopped', '10 to 12 curry leaves', '1 teaspoon black mustard seeds', '1 teaspoon cumin seeds', '1 pinch asafoetida (hing) - optional', '1 green chili, chopped', '½ teaspoon turmeric powder', '½ cup grated coconut - fresh or frozen', '1 or 2 tablespoon coconut oil', 'salt as required', 'coriander leaves for garnishing (optional)']"
468,https://www.vegrecipesofindia.com/raw-banana-kofta-recipe-kachche-kele-ke-kofte-navratri-recipes/,"Banana Kofta Recipe, Kachche Kele Ke Kofte Recipe | Raw Banana Kofta",North Indian,30 mins,"['Ingredients', '400 grams raw banana or 3 medium to large raw bananas', '1.5 cups for water for pressure cooking', '10 cashews (chopped) or 14 to 16 roasted peanuts - coarsely crushed', '½ inch ginger, finely chopped or ½ teaspoon finely chopped ginger', '1 green chili - finely chopped', '½ to 1 teaspoon freshly crushed black pepper', '½ teaspoon cumin powder', '1 teaspoon finely chopped mint leaves', '2 tablespoon arrow root flour or water chestnut flour or buckwheat flour or amaranth flour', 'rock salt as required', '2 tablespoon peanut oil or ghee for pan frying']"
469,https://www.vegrecipesofindia.com/gajar-matar-recipe/,"Gajar Matar Recipe, How To Make Gajar Matar Ki Sabzi Recipe",North Indian,30 mins,"['Ingredients', '4 to 5 medium size carrots (gajar)', '1 cup green peas (matar) - fresh or frozen', '1 teaspoon cumin (jeera)', '1 inch ginger (adrak) - finely chopped or grated', '1 or 2 green chilies (hari mirch)', '½ teaspoon red chili powder (lal mirch powder) - optional', '¼ teaspoon garam masala powder or punjabi garam masala', '2 tablespoon oil', '½ cup water', 'a few chopped coriander leaves (dhania patta) for garnishing, - optional', 'rock salt or regular salt as required']"
470,https://www.vegrecipesofindia.com/mango-almond-smoothie-vegan-recipe/,Mango Almond Smoothie,World,10 mins,"['Ingredients', '3 ripe alphonso mangoes', '15 to 18 almonds (badam) or add as required', '2 to 3 cardamom or ¼ teaspoon cardamom powder', 'sugar as required', 'some ice cubes', 'a few mint leaves for garnishing (pudina patta) - optional']"
471,https://www.vegrecipesofindia.com/pumpkin-bhaji-recipe-kaddu-ki-sabzi/,Pumpkin Bhaji | Pumpkin Ki Sabzi,Maharashtrian,25 mins,"['Ingredients', '1 to 1.5 tablespoon oil', '½ teaspoon mustard seeds', '½ teaspoon cumin seeds', '1 sprig curry leaves', '1 dry red chili - broken and deseeded or 1 green chili, chopped', '3 to 4 garlic - crushed with their peels or chopped', '1 pinch asafoetida (hing)', '300 grams pumpkin (kaddu) - cubed or chopped', '1 pinch turmeric powder', '¼ cup grated coconut', 'salt as required', '1 tablespoon chopped coriander leaves']"
472,https://www.vegrecipesofindia.com/mixed-sprouts-usal-recipe/,"Mixed Sprouts Usal Recipe, How To Make Mixed Sprouts Usal Recipe",Maharashtrian,35 mins,"['Ingredients', 'For Cooking Sprouts', '200 grams mixed sprouts, about 1.5 cups mixed sprouts', '3 cups water for cooking sprouts', 'For Usal', '1.5 tablespoon oil', '7 to 8 small garlic, sliced lengthwise', '½ cup chopped onion', '⅓ cup chopped tomatoes', '1 teaspoon chopped green chilies (hari mirch)', '1 teaspoon coriander powder (dhania powder)', '1.5 teaspoon goda masala or 1 teaspoon garam masala powder', '⅛ teaspoon asafoetida (hing)', '¼ teaspoon turmeric powder (haldi)', '1 cup water or as required', '¼ cup fresh grated coconut', '1 tablespoon coriander leaves, chopped finely (dhania patta)', 'salt as per taste', 'For Garnish', '1 to 2 lime wedges', '3 to 4 tablespoons finely chopped onions']"
473,https://www.vegrecipesofindia.com/cabbage-fried-rice-recipe/,Cabbage Rice | Indian Style Cabbage Fried Rice,Indian,1 hr,"['Ingredients', 'For Cooking Rice', '200 grams basmati rice or 1 cup heaped basmati rice - rinsed and soaked in water for 30 minutes', '1.5 cups water for pressure cooking rice', '¼ teaspoon salt as required', 'Other Ingredients', '2 to 2.5 tablespoon oil', '1 teaspoon cumin seeds', '1 inch cinnamon', '2 green cardamoms', '2 cloves', '1 small to medium tej patta (indian bay leaf)', '1 medium onion chopped or 1/3 cup chopped onion', '1 medium tomato chopped or 1/3 cup chopped tomatoes', '½ inch ginger + 4 medium garlic + 1 or 2 green chilies - crushed to a paste in mortar-pestle', '250 grams cabbage or 3 cups of shredded cabbage or half of a medium cabbage - shredded', '¼ teaspoon turmeric powder (ground turmeric)', '¼ teaspoon red chili powder', '¼ teaspoon garam masala powder', '½ teaspoon coriander powder (ground coriander)', 'salt as required', 'some chopped coriander leaves (cilantro leaves) or mint leaves for garnishing']"
474,https://www.vegrecipesofindia.com/sabudana-khichdi-recipe-maharashtrian-style/,How To Prepare Spicy Sabudana Khichdi (Solapur Style),Indian,2 hrs 30 mins,"['Ingredients', 'For Peanut Powder', '¼ cup roasted peanuts (moongphali) - dry grind roasted peanuts to powder', 'For Sabudana Khichdi', '2 tablespoons peanut oil, you can also use ghee', '1 cup sabudana (tapioca pearls)', '2 small to medium size potatoes (aloo) - peeled and chopped into small cubes', '¼ cup roasted peanuts (moongphali)', '1 to 3 green chilies (hari mirch) - chopped. you can add more green chilies if you want', '1 teaspoon cumin seeds (jeera)', '½ to 1 teaspoon sugar or as required', '½ to 1 teaspoon lime or lemon juice or as required (optional)', 'sendha namak or rock salt as required.']"
475,https://www.vegrecipesofindia.com/moong-dal-chilla-recipe/,"Moong Dal Chilla Recipe, How To Make Moong Dal Cheela",Indian,4 hrs 30 mins,"['Ingredients', '1 cup moong dal (split & husked moong lentils)', '2 to 3 cups water for soaking', '¼ cup water, for grinding or add as required', '¼ teaspoon turmeric powder (haldi)', '¼ teaspoon red chili powder (lal mirch powder)', '½ teaspoon roasted cumin powder or cumin powder (bhuna jeera powder)', '1 pinch hing (asafoetida)', '¼ cup chopped coriander leaves (dhania patta)', '¼ cup finely chopped onions', '1 teaspoon grated or finely chopped ginger (adrak)', '1 to 2 green chilies - finely chopped', '1 teaspoon salt or add as required', '1 to 2 tablespoon oil for cooking chillas or add as required']"
476,https://www.vegrecipesofindia.com/gobi-matar-recipe-gobi-recipes/,Gobi Matar,North Indian,1 hr 15 mins,"['Ingredients', '450 to 500 grams cauliflower (phool gobi) or 1 medium cauliflower', '¾ to 1 cup peas (matar) - fresh or frozen (check notes on when to add tender or frozen peas)', '120 grams onion or 2 medium sized onions - about 1 cup finely chopped onions', '1 large tomato or 3 small sized tomatoes - about ¾ cup finely chopped tomatoes', '2 to 3 green chillies or ½ to ¾ teaspoon finely chopped green chilies - reduce the amount of green chilies if making for kids', '1 inch ginger - about 1 to 1.25 teaspoon finely chopped or minced/grated ginger', '6 to 7 medium sized garlic or 4 to 5 large garlic - about 1 to 1.25 teaspoon finely chopped or minced garlic', '½ teaspoon caraway seeds (shah jeera)', '1 inch cinnamon', '2 green cardamoms', '½ of a star anise (chakra phool) - optional', '4 to 5 black pepper', '1 small to medium tej patta (indian bay leaf)', '¼ teaspoon turmeric powder', '¼ teaspoon kashmiri red chili powder (optional)', '1 teaspoon coriander powder', '¼ teaspoon garam masala powder', '2 to 3 cloves', '2 to 3 tablespoon oil', 'salt as required', 'some chopped mint leaves or coriander leaves for garnish']"
477,https://www.vegrecipesofindia.com/cabbage-kootu-recipe-cabbage-dal/,"Cabbage Kootu Recipe, How To Make Cabbage Kootu | Cabbage Dal","South Indian, Tamil Nadu",40 mins,"['Ingredients', 'For Cooking Cabbage And Moong Dal', '2 to 2.5 cups chopped cabbage', '½ cup moong dal (husked split moong lentils)', '¼ teaspoon turmeric powder', '2 to 2.25 cups water', 'To Be Ground To A Paste', '¼ cup grated fresh coconut', '1 to 2 green chilies - chopped', '1 teaspoon cumin seeds', '2 to 3 tablespoons water for grinding', 'Other Ingredients', '2 teaspoons rice flour - optional', 'salt as required', '2 tablespoons chopped coriander leaves (cilantro leaves) - optional', 'For Tempering Cabbage Kootu', '1 tablespoon coconut oil', '½ teaspoon mustard seeds', '½ teaspoon urad dal (split and husked black gram)', '1 pinch asafoetida (hing)', '10 to 12 curry leaves or 1 sprig curry leaves']"
478,https://www.vegrecipesofindia.com/fugad-de-repolho-goan-cabbage-recipe/,"Cabbage Foogath Recipe, Goan Style Steamed Cabbage With Coconut",Goan,30 mins,"['Ingredients', '1 medium sized cabbage, finely sliced (patta gobhi)', '1 medium sized onion, chopped or sliced', '½ tablespoon chopped ginger (adrak)', '2 to 3 garlic, chopped (lahsun)', '1 or 2 green chilies, chopped', '2 to 3 tablespoon grated coconut or desiccated coconut', 'salt to taste']"
479,https://www.vegrecipesofindia.com/cabbage-thoran/,Cabbage Thoran Recipe | Cabbage Fry Recipe | How To Make Cabbage Thoran,Kerala,30 mins,"['Ingredients', '1 medium sized cabbage', '1 medium sized onion or 4 to 5 shallots - finely chopped', '10 to 12 curry leaves', '1 teaspoon black mustard seeds', '1 teaspoon cumin seeds', '1 pinch asafoetida (hing) - optional', '1 green chili, chopped', '½ teaspoon turmeric powder', '½ cup grated coconut - fresh or frozen', '1 or 2 tablespoon coconut oil', 'salt as required', 'coriander leaves for garnishing (optional)']"
480,https://www.vegrecipesofindia.com/ajwain-paratha/,Ajwain Paratha Recipe | Crisp & Flaky Punjabi Ajwain Ka Paratha Recipe,North Indian,50 mins,"['Ingredients', 'For The Dough', '2 cups whole wheat flour (atta)', '1 or 2 teaspoon oil or ghee', 'salt as required', 'water as required', 'For The Paratha', '1 tablespoon ajwain (carom seeds or thymol seeds or bishops weed or omam or owa or ajmo)', 'oil or ghee as required', 'salt as required']"
481,https://www.vegrecipesofindia.com/sesame-veg-toast-recipe/,Sesame Toast,Indo Chinese,1 hr 10 mins,"['Ingredients', 'For Sesame Toast Filling', '1 small to medium carrot, finely chopped - approx ½ cup finely chopped carrot', '8 to 10 french beans, finely chopped - approx ¼ cup finely chopped beans', '1 medium potato, boiled - approx ½ cup of mashed potato', '1 small capsicum (green bell pepper or shimla mirch) - ¼ cup finely chopped capsicum', '1 small to medium onion - ¼ cup finely chopped onion', '1 teaspoon chopped celery or coriander leaves', '1 green chili, finely chopped', '½ inch ginger, finely chopped', '2 to 3 garlic cloves, finely chopped', '1 tablespoon corn starch', '½ tablespoon naturally fermented soy sauce or as required', '2 to 3 tablespoon sesame seeds or as required', 'salt and black pepper as required', 'For The Cornstarch Solution', '3 tablespoon cornflour (corn starch)', '2 to 3 tablespoon water', 'Other Ingredients', '4 to 5 slices of bread - white bread, brown bread or whole wheat', 'oil for shallow frying or deep frying']"
482,https://www.vegrecipesofindia.com/palak-chole-recipe-palak-chole/,Palak Chole | Spinach With Chickpeas,"Indian, Punjabi",53 mins,"['Ingredients', 'Main Ingredients', '4.5 or 5 cups chopped spinach or palak', '1 cup dried white chickpeas (chole or kabuli chana or safed chana)', '1 large tomato - pureed', '1.5 to 2 cups water', '3 to 4 tablespoon oil', '¾ teaspoon pomegranate seed - dry roasted and crushed or ½ to ¾ teaspoon dry mango powder (amchur powder)', '1 teaspoon kasuri methi - crushed (dry fenugreek leaves)', 'salt as required - for boiling chole and for the gravy', 'To Be Ground To Paste', '1 large onion, roughly chopped', '1 or 2 green chilies , chopped', '3 to 4 garlic cloves , chopped', '½ inch ginger , chopped, optional', 'Whole Spices For Palak Chana', '1 inch cinnamon', '3 cloves', '2 green cardamom', '1 black cardamom', '1 tej patta (indian bay leaf)', 'Spice Powders For Palak Chole', '½ teaspoon cumin powder (ground cumin)', '1 teaspoon coriander powder (ground coriander)', '½ teaspoon red chili powder', '¼ teaspoon turmeric powder', '¾ teaspoon punjabi garam masala powder or chana masala powder or garam masala powder']"
483,https://www.vegrecipesofindia.com/instant-pot-pulao/,Instant Pot Pulao,North Indian,25 mins,"['Ingredients', 'For Rice', '1.5 cups basmati rice - 260 grams', 'enough water for soaking rice', 'Vegetables And Other Ingredients', '3 tablespoons oil - use sunflower oil or any neutral tasting oil. ghee can be substituted with oil.', '½ cup thinly sliced onions or 1 medium to large onion, finely sliced', '⅓ cup chopped tomato or 1 medium sized chopped tomatoes', '2 tablespoon coriander leaves , chopped', '1 tablespoon mint leaves , chopped - optional', '2 teaspoons ginger+garlic paste or 1 inch ginger and 4 to 5 medium garlic cloves, crushed in mortar-pestle', '1 to 2 green chillies , chopped or 1 to 2 serrano peppers', '¼ teaspoon turmeric powder (ground turmeric)', '½ teaspoon kashmiri red chilli powder or ¼ teaspoon cayenne pepper or paprika', '1 teaspoon coriander powder (ground coriander)', '1 pinch asafoetida (hing) - optional', '3 cups chopped mixed veggies (i used a mix of cauliflower, french beans, potatoes and carrots)', '¼ to ⅓ cup green peas - fresh or frozen', '2 cups water or add as required', 'salt as required', 'Whole Spices', '2 small tejpatta (indian bay leaf) or 1 medium to large tej patta', '2 to 3 cloves', '4 to 5 black pepper', '1 piece small of stone flower (pathar ke phool or kalpasi or dagad phool) - optional', '½ inch cinnamon', '2 green cardamoms', '1 black cardamom - optional', '1 or 2 single strands of mace', '1 star anise - optional', '1 teaspoon fennel seeds - optional', '½ teaspoon cumin seeds', 'Equipment', 'Instant Pot Duo 6 Quartz or 5.7 Litres']"
484,https://www.vegrecipesofindia.com/pakora-recipe-basic-pakora-recipe/,Pakora Recipe | Pakoda Recipe | How To Make Pakora Recipe | Pakora Recipes,Indian,35 mins,"['Ingredients', '1 cup besan (gram flour)', '½ inch ginger (adrak) - finely chopped', '1 small to medium onion, finely chopped', '1 green chili, (hari mirch) - chopped', '2 tablespoon chopped coriander leaves (dhania patta)', '2 to 3 pinch of baking soda', 'water as required to make a thick flowing batter - i used slightly more than ¼ cup of water', 'salt as required', 'oil for deep frying the pakoras']"
485,https://www.vegrecipesofindia.com/gulgule-recipe/,Gulgule Recipe (Pua Or Gulgula),Punjabi,5 mins,"['Ingredients', 'For Mashing Bananas', '½ cup chopped bananas or 1 small banana', '6 tablespoons raw sugar or white sugar or jaggery - add as per taste', 'For Batter', '1 cup whole wheat flour', '1 teaspoon fennel seeds (saunf)', '¼ teaspoon cardamom powder - optional', '1 pinch salt', '½ teaspoon baking powder', '8 to 11 tablespoons water or add as required', 'Other Ingredient', 'oil as required - for deep frying']"
486,https://www.vegrecipesofindia.com/mixed-sprouts-usal-recipe/,"Mixed Sprouts Usal Recipe, How To Make Mixed Sprouts Usal Recipe",Maharashtrian,35 mins,"['Ingredients', 'For Cooking Sprouts', '200 grams mixed sprouts, about 1.5 cups mixed sprouts', '3 cups water for cooking sprouts', 'For Usal', '1.5 tablespoon oil', '7 to 8 small garlic, sliced lengthwise', '½ cup chopped onion', '⅓ cup chopped tomatoes', '1 teaspoon chopped green chilies (hari mirch)', '1 teaspoon coriander powder (dhania powder)', '1.5 teaspoon goda masala or 1 teaspoon garam masala powder', '⅛ teaspoon asafoetida (hing)', '¼ teaspoon turmeric powder (haldi)', '1 cup water or as required', '¼ cup fresh grated coconut', '1 tablespoon coriander leaves, chopped finely (dhania patta)', 'salt as per taste', 'For Garnish', '1 to 2 lime wedges', '3 to 4 tablespoons finely chopped onions']"
487,https://www.vegrecipesofindia.com/vegan-vermicelli-kheer-vegan-seviyan-kheer/,Vegan Pudding Recipe | Vermicelli Pudding Recipe | Vegan Sweets Recipes,Indian,30 mins,"['Ingredients', '1.5 cup almond milk', '1.5 cup cashew milk', '1.5 cup wheat vermicelli (seviyan)', '1.5 cup water', '8 to 9 tablespoon sugar - add less or more for desired sweetness', '4 to 5 green cardamon (choti elaichi), crushed or ½ teaspoon cardamom powder', '1 tablespoon black currants, sliced or chopped', '1 pinch saffron (kesar)']"
488,https://www.vegrecipesofindia.com/gutti-vankaya-kura-recipe/,Gutti Vankaya | Gutti Vankaya Kura | Gutti Vankaya Curry,Andhra,40 mins,"['Ingredients', 'For Soaking Brinjals', '250 grams small purple or green brinjals (baingan) or 12 to 14 brinjals', '½ teaspoon salt added to water for soaking brinjals', 'enough water for soaking brinjals', 'Other Ingredients For Gutti Vankaya Kura', '1 large onion or ½ cup finely chopped onion', '½ tablespoon ginger-garlic paste or 1 inch ginger + 6 to 7 medium garlic - crushed to a paste', '1 teaspoon mustard seeds (rai)', '½ teaspoon urad dal', '½ teaspoon cumin seeds (jeera)', '1 sprig curry leaves (kadi patta)', '2 tablespoon oil', '⅔ cup water', 'salt as required', '2 to 3 tablespoon chopped coriander leaves (dhania patta)', 'For Tamarind Pulp', '½ tablespoon tamarind (imli)', '¼ cup warm or hot water', 'For Grinding Masala', '¼ cup peanuts (moongphali)', '2 tablespoon desiccated coconut', '1 tablespoon coriander seeds (sabut dhania)', '½ teaspoon cumin seeds (jeera)', '¼ teaspoon methi seeds (fenugreek seeds)', '3 to 4 dry red chilies (sookhi lal mirch)', '½ teaspoon turmeric powder (haldi)']"
489,https://www.vegrecipesofindia.com/red-chili-coconut-chutney/,Red Chilli Chutney With Chana Dal (Tamil Nadu Style),South Indian,10 mins,"['Ingredients', 'Main Ingredients', '½ cup grated coconut fresh or frozen', '¼ cup roasted chana dal (roasted bengal gram)', '1 or 2 dry red chilis', '1 teaspoon chopped ginger', '2 to 3 garlic cloves , chopped', '1 teaspoon tamarind', 'salt as required', '½ cup water for grinding or as required', 'For Tempering The Chutney', '1 tablespoon oil', '1 teaspoon mustard', '1 teaspoon cumin', 'a pinch of asafoetida (hing)', '1 sprig curry leaves']"
490,https://www.vegrecipesofindia.com/rice-sevai-upma-recipe/,Akki Shavige Uppittu | Rice Sevai Upma | Rice Vermicelli Upma,"Karnataka, South Indian",25 mins,"['Ingredients', 'Cooking Rice Vermicelli', '180 grams Akki Shavige (rice sevai or rice vermicelli or rice seviyan) or about 1.75 cups akki shavige', '4.5 to 5 cups water for cooking rice vermicelli', 'For Tempering', '1 teaspoon mustard seeds', '1 or 2 green chilies chopped', '½ inch ginger - finely chopped, about 1 teaspoon finely chopped ginger', '1 medium onion - finely chopped', '8 to 10 curry leaves', '12 to 15 cashews - halved or whole', '4 to 5 tablespoon grated coconut or add as required', '2 tablespoon coconut oil or any oil or you can also use ghee', '2 to 3 tablespoon chopped coriander leaves', '1 small to medium lime or lemon - sliced or diced to be served with the upma', 'salt as required']"
491,https://www.vegrecipesofindia.com/aloo-baingan-potatoes-with-green-eggplant-recipe/,Bharwa Baingan | Stuffed Baingan,"North Indian, Punjabi",35 mins,"['Ingredients', '250 grams small brinjals (baingan or eggplants), about medium green baingan/eggplants or 18 to 20 small brinjals', '250 grams regular potatoes or baby potatoes, about 2 to 3 medium potatoes or 15 to 18 baby potatoes - optional', '½ tsp turmeric', '1 tsp garam masala powder', '1 tsp chilli powder', '1 tsp dried mango powder (amchur)', '1 tsp coriander powder (ground coriander)', '1 tsp cumin powder', '1 tsp salt or add as required', '2 tbsp oil']"
492,https://www.vegrecipesofindia.com/green-peas-usal-matar-usal/,"Matar Usal Recipe, How To Make Matar Usal | Green Peas Usal",Maharashtrian,40 mins,"['Ingredients', 'Main Ingredients For Matar Usal', '2 cups fresh or frozen green peas (vatana or matar)', '½ teaspoon powdered jaggery or sugar - add as required', '2 teaspoon goda masala (black masala)', '1 teaspoon lemon juice (optional)', 'water as required', 'salt as required', 'For Tempering Matar Usal', '2 tablespoon oil', '½ teaspoon mustard seeds (rai)', '¼ to ⅓ teaspoon turmeric powder (haldi)', '2 pinches asafoetida (hing)', 'For Ground Paste', '3 tablespoon grated coconut, fresh or frozen', '1.5 to 2 tablespoon chopped coriander leaves (dhania patta)', '1 or 2 green chilies (hari mirch) - chopped', '1 teaspoon cumin seeds (jeera)', '1 inch ginger (adrak) - chopped', '3 tablespoon water for grinding']"
493,https://www.vegrecipesofindia.com/roasted-oats-chivda-recipe/,"Oats Chivda Recipe, How To Make Oats Chivda",Indian,20 mins,"['Ingredients', '1 cup oats (quick cooking oats)', '1 tablespoon oil for tempering', '5 to 6 almonds', '5 to 6 cashews', '1 tablespoon peanuts', '1 tablespoon golden raisins', '½ teaspoon sugar', '1 pinch asafoetida (hing)', '1 to 2 green chilies - sliced or slit', '8 to 10 curry leaves', 'salt as per taste']"
494,https://www.vegrecipesofindia.com/sesame-veg-toast-recipe/,Sesame Toast,Indo Chinese,1 hr 10 mins,"['Ingredients', 'For Sesame Toast Filling', '1 small to medium carrot, finely chopped - approx ½ cup finely chopped carrot', '8 to 10 french beans, finely chopped - approx ¼ cup finely chopped beans', '1 medium potato, boiled - approx ½ cup of mashed potato', '1 small capsicum (green bell pepper or shimla mirch) - ¼ cup finely chopped capsicum', '1 small to medium onion - ¼ cup finely chopped onion', '1 teaspoon chopped celery or coriander leaves', '1 green chili, finely chopped', '½ inch ginger, finely chopped', '2 to 3 garlic cloves, finely chopped', '1 tablespoon corn starch', '½ tablespoon naturally fermented soy sauce or as required', '2 to 3 tablespoon sesame seeds or as required', 'salt and black pepper as required', 'For The Cornstarch Solution', '3 tablespoon cornflour (corn starch)', '2 to 3 tablespoon water', 'Other Ingredients', '4 to 5 slices of bread - white bread, brown bread or whole wheat', 'oil for shallow frying or deep frying']"
495,https://www.vegrecipesofindia.com/palak-chole-recipe-palak-chole/,Palak Chole | Spinach With Chickpeas,"Indian, Punjabi",53 mins,"['Ingredients', 'Main Ingredients', '4.5 or 5 cups chopped spinach or palak', '1 cup dried white chickpeas (chole or kabuli chana or safed chana)', '1 large tomato - pureed', '1.5 to 2 cups water', '3 to 4 tablespoon oil', '¾ teaspoon pomegranate seed - dry roasted and crushed or ½ to ¾ teaspoon dry mango powder (amchur powder)', '1 teaspoon kasuri methi - crushed (dry fenugreek leaves)', 'salt as required - for boiling chole and for the gravy', 'To Be Ground To Paste', '1 large onion, roughly chopped', '1 or 2 green chilies , chopped', '3 to 4 garlic cloves , chopped', '½ inch ginger , chopped, optional', 'Whole Spices For Palak Chana', '1 inch cinnamon', '3 cloves', '2 green cardamom', '1 black cardamom', '1 tej patta (indian bay leaf)', 'Spice Powders For Palak Chole', '½ teaspoon cumin powder (ground cumin)', '1 teaspoon coriander powder (ground coriander)', '½ teaspoon red chili powder', '¼ teaspoon turmeric powder', '¾ teaspoon punjabi garam masala powder or chana masala powder or garam masala powder']"
496,https://www.vegrecipesofindia.com/adai-recipe/,Adai Recipe | Adai Dosa,"South Indian, Tamil Nadu",2 hrs 40 mins,"['Ingredients', 'For Soaking', '½ cup regular rice or idli rice or parboiled rice', '¼ cup chana dal (split and husked bengal gram)', '¼ cup urad dal (split and husked black gram)', '¼ cup tuvar dal (arhar dal, pigeon pea lentils)', '2 dry red chilies - byadagi or kashmiri', '1.5 cups water for soaking', 'For Making Adai Batter', '1.5 teaspoons chopped ginger', '1 generous pinch hing', '1 chopped green chili - optional', '½ teaspoon cumin seeds - optional', '⅔ to ¾ cup water for grinding or add as required', '⅓ cup finely chopped onions or pearl onions or shallots', '2 teaspoons chopped curry leaves or 8 to 10 curry leaves - chopped', '¼ cup chopped coriander leaves', '¼ cups grated coconut - optional', 'Other Ingredients', 'salt as required', 'oil as required']"
497,https://www.vegrecipesofindia.com/amla-pickle-recipe-amla-avakaya/,Amla Pickle | Indian Gooseberry Pickle,Andhra,30 mins,"['Ingredients', '250 grams amla or about 2 cups chopped amla (Indian gooseberry)', '⅓ cup sesame oil (gingelly oil) for frying amla', '2 to 3 small to medium garlic cloves - slightly crushed', '2 tablespoons mustard seeds or 3 tablespoon mustard seeds powder', '¼ teaspoon fenugreek seeds', '3 tablespoons red chilli powder', '1 teaspoon turmeric powder', '1 to 1.5 tablespoons salt or add as required', '1 tablespoon lemon juice', '¼ cup sesame oil - to be added later', '¼ teaspoon asafoetida (hing)']"
498,https://www.vegrecipesofindia.com/kala-chana-chaat/,Kala Chana Chaat,Indian,12 mins,"['Ingredients', '1 cup dried black chickpeas (kala chana) or 2.5 to 3 cups cooked black chickpeas', '1 medium onion, finely chopped', '1 large tomato, finely chopped', '1 small raw mango, peeled and finely chopped (optional) - the one i added was a little ripe', '1 to 2 green chilies, finely chopped or minced', '1 teaspoon red chili powder or cayenne pepper', '1 teaspoon chaat masala', '1 teaspoon roasted cumin powder', '1 teaspoon dry mango powder (amchur powder)', '2 to 3 teaspoons lemon juice or add as required', '½ teaspoon black salt - add more if required', 'some chopped coriander leaves for garnishing']"
